[I 2023-10-12 16:27:25,593] Trial 87 finished with value: 0.9998841133950429 and parameters: {'learning_rate': 0.0689127583265031, 'max_depth': 7, 'max_features': 'log2', 'n_estimators': 377}. Best is trial 84 with value: 0.9999275708719019.
[I 2023-10-12 16:28:57,447] Trial 88 finished with value: 0.9998551417438036 and parameters: {'learning_rate': 0.04409648744645278, 'max_depth': 6, 'max_features': 'sqrt', 'n_estimators': 413}. Best is trial 84 with value: 0.9999275708719019.
[I 2023-10-12 16:30:51,729] Trial 89 finished with value: 0.9998985992206626 and parameters: {'learning_rate': 0.08543212414008276, 'max_depth': 9, 'max_features': 'log2', 'n_estimators': 395}. Best is trial 84 with value: 0.9999275708719019.
[I 2023-10-12 16:32:40,416] Trial 90 finished with value: 0.999840655918184 and parameters: {'learning_rate': 0.013833551242305052, 'max_depth': 6, 'max_features': 'log2', 'n_estimators': 348}. Best is trial 84 with value: 0.9999275708719019.
[I 2023-10-12 16:35:39,485] Trial 91 finished with value: 0.9998696275694233 and parameters: {'learning_rate': 0.02675742222562067, 'max_depth': 8, 'max_features': 'log2', 'n_estimators': 429}. Best is trial 84 with value: 0.9999275708719019.
[I 2023-10-12 16:38:30,267] Trial 92 finished with value: 0.9998985992206626 and parameters: {'learning_rate': 0.021767682080723192, 'max_depth': 8, 'max_features': 'log2', 'n_estimators': 407}. Best is trial 84 with value: 0.9999275708719019.
[I 2023-10-12 16:41:02,235] Trial 93 finished with value: 0.9998985992206626 and parameters: {'learning_rate': 0.03497556275869474, 'max_depth': 8, 'max_features': 'log2', 'n_estimators': 365}. Best is trial 84 with value: 0.9999275708719019.
[I 2023-10-12 16:43:17,078] Trial 94 finished with value: 0.9998696275694233 and parameters: {'learning_rate': 0.026592093860207774, 'max_depth': 8, 'max_features': 'log2', 'n_estimators': 323}. Best is trial 84 with value: 0.9999275708719019.
[I 2023-10-12 16:45:20,296] Trial 95 finished with value: 0.9998696275694233 and parameters: {'learning_rate': 0.018720235336173348, 'max_depth': 7, 'max_features': 'log2', 'n_estimators': 338}. Best is trial 84 with value: 0.9999275708719019.
[I 2023-10-12 16:47:27,174] Trial 96 finished with value: 0.9998841133950429 and parameters: {'learning_rate': 0.015090998258594519, 'max_depth': 9, 'max_features': 'log2', 'n_estimators': 267}. Best is trial 84 with value: 0.9999275708719019.
[I 2023-10-12 16:48:27,295] Trial 97 finished with value: 0.999840655918184 and parameters: {'learning_rate': 0.0296267472329193, 'max_depth': 7, 'max_features': 'sqrt', 'n_estimators': 230}. Best is trial 84 with value: 0.9999275708719019.
[I 2023-10-12 16:51:10,262] Trial 98 finished with value: 0.9999130850462822 and parameters: {'learning_rate': 0.011027998566559309, 'max_depth': 8, 'max_features': 'log2', 'n_estimators': 390}. Best is trial 84 with value: 0.9999275708719019.
[I 2023-10-12 16:53:18,870] Trial 99 finished with value: 0.9998551417438036 and parameters: {'learning_rate': 0.04982121632092054, 'max_depth': 7, 'max_features': 'log2', 'n_estimators': 355}. Best is trial 84 with value: 0.9999275708719019.
Best Hyperparameters: {'learning_rate': 0.02736280904310148, 'max_depth': 8, 'max_features': 'log2', 'n_estimators': 384}
Best Accuracy: 0.9999275708719019




Best Hyperparameters: {'learning_rate': 0.012547463877799665, 'max_depth': 7, 'max_features': 'sqrt', 'n_estimators': 237}
